{
  "non_authoritative": [
    "docs/research/",
    "docs/design/",
    "conversation memory",
    "worker summaries"
  ],
  "project": "voyage-skill",
  "schema_version": "0.1.0",
  "sources": [
    {
      "authority": "user-approved-baseline",
      "domain": "product",
      "id": "product-contract",
      "path": "docs/product/contract.md",
      "status": "active",
      "version": "0.1.0"
    },
    {
      "authority": "user-approved-baseline",
      "domain": "governance",
      "id": "governance-authority",
      "path": "docs/governance/authority.md",
      "status": "active",
      "version": "0.1.0"
    },
    {
      "authority": "user-approved-baseline",
      "domain": "system",
      "id": "system-graph",
      "path": "docs/system/graph.md",
      "status": "active",
      "version": "0.1.0"
    },
    {
      "authority": "user-approved-baseline",
      "domain": "operations",
      "id": "operations-runbook",
      "path": "docs/operations/runbook.md",
      "status": "active",
      "version": "0.1.0"
    },
    {
      "authority": "user-decision:USER-MK101-OPTIONAL-TRUTH",
      "domain": "planning",
      "id": "development-plan",
      "path": "docs/planning.md",
      "status": "active",
      "version": "1"
    },
    {
      "authority": "user-decision:USER-MK101-OPTIONAL-TRUTH",
      "domain": "decisions",
      "id": "decision-log",
      "path": "docs/decisions/index.md",
      "status": "active",
      "version": "2"
    }
  ],
  "updated_at": "2026-08-17"
}
